{
  "runId": "pablo-20260814-151114",
  "agentId": "pablo",
  "startedAt": "2026-08-14T15:11:14.508Z",
  "endedAt": "2026-08-14T15:11:15.028Z",
  "mode": "components",
  "targetComponents": [
    "../gm-salesplanning-frontend/src/components/Signin/signin.tsx",
    "../gm-salesplanning-frontend/src/components/User/user.tsx"
  ],
  "bob": {
    "checked": 2,
    "regenerated": 2,
    "reused": 0,
    "regeneratedComponents": [
      "../gm-salesplanning-frontend/src/components/Signin/signin.tsx",
      "../gm-salesplanning-frontend/src/components/User/user.tsx"
    ],
    "stdout": "[Bob] Starting test generation run.\n[Bob] Scanning components under: /Users/timothy.collins/Documents/ikea work/gm-salesplanning-frontend/src\n[Bob] Discovered 34 component candidates; targeting 2 component(s).\n[Bob] Created runtime-aware QA plan for SignIn.\n[Bob] Created runtime-aware QA plan for user.\n[Bob] Generation complete.\n[Bob] Target root: /Users/timothy.collins/Documents/ikea work/gm-salesplanning-frontend/src\n[Bob] Output dir: /Users/timothy.collins/Documents/ikea work/gm-salesplanning-ai-qa/component-poc/qa-agent/agents/bob/generated-tests\n[Bob] Components discovered: 34\n[Bob] Components targeted: 2\n[Bob] Created: 2, Updated: 0, Skipped: 0\n[Bob] State file: /Users/timothy.collins/Documents/ikea work/gm-salesplanning-ai-qa/component-poc/qa-agent/agents/bob/generated-tests/.bob-memory.json\n[Bob] Index: /Users/timothy.collins/Documents/ikea work/gm-salesplanning-ai-qa/component-poc/qa-agent/agents/bob/generated-tests/INDEX.md\n"
  },
  "susan": {
    "overallStatus": "pass",
    "components": 2,
    "tests": 4,
    "passed": 4,
    "failed": 0,
    "stdout": "[Susan] Starting QA execution run.\n[Susan] Reading Bob plans from: /Users/timothy.collins/Documents/ikea work/gm-salesplanning-ai-qa/component-poc/qa-agent/agents/bob/generated-tests\n[Susan] Found 2 plan file(s) to evaluate before scope filtering.\n[Susan] Running tests for signin (../gm-salesplanning-frontend/src/components/Signin/signin.tsx).\n[Susan] Running tests for user (../gm-salesplanning-frontend/src/components/User/user.tsx).\n[Susan] Execution complete.\n[Susan] Bob plans directory: /Users/timothy.collins/Documents/ikea work/gm-salesplanning-ai-qa/component-poc/qa-agent/agents/bob/generated-tests\n[Susan] Components checked: 2\n[Susan] Tests executed: 4\n[Susan] Passed: 4, Failed: 0\n[Susan] Overall: pass\n[Susan] JSON result: /Users/timothy.collins/Documents/ikea work/gm-salesplanning-ai-qa/component-poc/qa-agent/agents/susan/results/susan-result-20260814-151115.json\n[Susan] Markdown result: /Users/timothy.collins/Documents/ikea work/gm-salesplanning-ai-qa/component-poc/qa-agent/agents/susan/results/susan-result-20260814-151115.md\n",
    "componentResults": [
      {
        "component": "signin",
        "source": "../gm-salesplanning-frontend/src/components/Signin/signin.tsx",
        "status": "pass",
        "tests": [
          {
            "testId": "BOB-HP-001",
            "status": "pass",
            "checks": [
              {
                "name": "source-file-exists",
                "status": "pass",
                "details": "Source component file found"
              },
              {
                "name": "source-shape-valid",
                "status": "pass",
                "details": "Source appears to contain component export or JSX structure"
              },
              {
                "name": "jira-issue-key-coverage",
                "status": "pass",
                "details": "Plan includes requested Jira issue keys"
              }
            ],
            "reasons": []
          },
          {
            "testId": "BOB-SP-001",
            "status": "pass",
            "checks": [
              {
                "name": "source-file-exists",
                "status": "pass",
                "details": "Source component file found"
              },
              {
                "name": "source-shape-valid",
                "status": "pass",
                "details": "Source appears to contain component export or JSX structure"
              },
              {
                "name": "jira-issue-key-coverage",
                "status": "pass",
                "details": "Plan includes requested Jira issue keys"
              }
            ],
            "reasons": []
          }
        ]
      },
      {
        "component": "user",
        "source": "../gm-salesplanning-frontend/src/components/User/user.tsx",
        "status": "pass",
        "tests": [
          {
            "testId": "BOB-HP-001",
            "status": "pass",
            "checks": [
              {
                "name": "source-file-exists",
                "status": "pass",
                "details": "Source component file found"
              },
              {
                "name": "source-shape-valid",
                "status": "pass",
                "details": "Source appears to contain component export or JSX structure"
              },
              {
                "name": "jira-issue-key-coverage",
                "status": "pass",
                "details": "Plan includes requested Jira issue keys"
              }
            ],
            "reasons": []
          },
          {
            "testId": "BOB-SP-001",
            "status": "pass",
            "checks": [
              {
                "name": "source-file-exists",
                "status": "pass",
                "details": "Source component file found"
              },
              {
                "name": "source-shape-valid",
                "status": "pass",
                "details": "Source appears to contain component export or JSX structure"
              },
              {
                "name": "jira-issue-key-coverage",
                "status": "pass",
                "details": "Plan includes requested Jira issue keys"
              }
            ],
            "reasons": []
          }
        ]
      }
    ]
  },
  "jira": {
    "project": "SSPLAN",
    "issueKeys": [
      "SSPLAN-426"
    ],
    "source": "jira-api",
    "warnings": [],
    "issues": [
      {
        "key": "SSPLAN-426",
        "summary": "Forecast & Simulation Model Architecture, Framework & Design",
        "updatedAt": "2026-08-07T14:53:53.572+0000",
        "hasAcceptanceCriteria": true
      }
    ],
    "acFilePath": "/Users/timothy.collins/Documents/ikea work/gm-salesplanning-ai-qa/component-poc/qa-agent/agents/pablo/results/.pablo-jira-ac-20260814-151114.txt"
  },
  "overallStatus": "pass",
  "failureReasons": []
}
