{
  "runId": "pablo-20260814-145856",
  "agentId": "pablo",
  "startedAt": "2026-08-14T14:58:56.503Z",
  "endedAt": "2026-08-14T14:58:57.237Z",
  "mode": "components",
  "targetComponents": [],
  "bob": {
    "checked": 0,
    "regenerated": 0,
    "reused": 0,
    "regeneratedComponents": [],
    "stdout": ""
  },
  "susan": {
    "overallStatus": "pass",
    "components": 0,
    "tests": 0,
    "passed": 0,
    "failed": 0,
    "stdout": "",
    "componentResults": []
  },
  "jira": {
    "project": "SSPLAN",
    "issueKeys": [
      "SSPLAN-547"
    ],
    "source": "jira-api",
    "warnings": [],
    "issues": [
      {
        "key": "SSPLAN-547",
        "summary": "Define data concepts",
        "updatedAt": "2026-08-12T18:02:44.167+0000",
        "hasAcceptanceCriteria": true
      }
    ],
    "acFilePath": "/Users/timothy.collins/Documents/ikea work/gm-salesplanning-ai-qa/component-poc/qa-agent/agents/pablo/results/.pablo-jira-ac-20260814-145856.txt"
  },
  "overallStatus": "pass",
  "failureReasons": []
}
