{
  "runId": "pablo-20260814-140434",
  "agentId": "pablo",
  "startedAt": "2026-08-14T14:04:34.054Z",
  "endedAt": "2026-08-14T14:04:34.740Z",
  "mode": "components",
  "targetComponents": [
    "../gm-salesplanning-frontend/src/components/Shared/DashboardComponents/GraphComponents/SalesByWeek/sales-by-week.tsx"
  ],
  "bob": {
    "checked": 1,
    "regenerated": 1,
    "reused": 0,
    "regeneratedComponents": [
      "../gm-salesplanning-frontend/src/components/Shared/DashboardComponents/GraphComponents/SalesByWeek/sales-by-week.tsx"
    ],
    "stdout": "[Bob] Starting test generation run.\n[Bob] Scanning components under: /Users/timothy.collins/Documents/ikea work/gm-salesplanning-frontend/src\n[Bob] Discovered 34 component candidates; targeting 1 component(s).\n[Bob] Reusing existing QA plan for SalesByWeek.\n[Bob] Generation complete.\n[Bob] Target root: /Users/timothy.collins/Documents/ikea work/gm-salesplanning-frontend/src\n[Bob] Output dir: /Users/timothy.collins/Documents/ikea work/gm-salesplanning-ai-qa/component-poc/qa-agent/agents/bob/generated-tests\n[Bob] Components discovered: 34\n[Bob] Components targeted: 1\n[Bob] Created: 0, Updated: 0, Skipped: 1\n[Bob] State file: /Users/timothy.collins/Documents/ikea work/gm-salesplanning-ai-qa/component-poc/qa-agent/agents/bob/generated-tests/.bob-memory.json\n[Bob] Index: /Users/timothy.collins/Documents/ikea work/gm-salesplanning-ai-qa/component-poc/qa-agent/agents/bob/generated-tests/INDEX.md\n"
  },
  "susan": {
    "overallStatus": "pass",
    "components": 1,
    "tests": 2,
    "passed": 2,
    "failed": 0,
    "stdout": "[Susan] Starting QA execution run.\n[Susan] Reading Bob plans from: /Users/timothy.collins/Documents/ikea work/gm-salesplanning-ai-qa/component-poc/qa-agent/agents/bob/generated-tests\n[Susan] Found 1 plan file(s) to evaluate before scope filtering.\n[Susan] Running tests for sales-by-week (../gm-salesplanning-frontend/src/components/Shared/DashboardComponents/GraphComponents/SalesByWeek/sales-by-week.tsx).\n[Susan] Execution complete.\n[Susan] Bob plans directory: /Users/timothy.collins/Documents/ikea work/gm-salesplanning-ai-qa/component-poc/qa-agent/agents/bob/generated-tests\n[Susan] Components checked: 1\n[Susan] Tests executed: 2\n[Susan] Passed: 2, Failed: 0\n[Susan] Overall: pass\n[Susan] JSON result: /Users/timothy.collins/Documents/ikea work/gm-salesplanning-ai-qa/component-poc/qa-agent/agents/susan/results/susan-result-20260814-140434.json\n[Susan] Markdown result: /Users/timothy.collins/Documents/ikea work/gm-salesplanning-ai-qa/component-poc/qa-agent/agents/susan/results/susan-result-20260814-140434.md\n"
  },
  "jira": {
    "project": "SSPLAN",
    "issueKeys": [
      "SSPLAN-623"
    ],
    "source": "jira-api",
    "warnings": [],
    "issues": [
      {
        "key": "SSPLAN-623",
        "summary": "Show Weekly Sales vs Latest Financial Forecast",
        "updatedAt": "2026-08-06T12:50:28.593+0000",
        "hasAcceptanceCriteria": true
      }
    ],
    "acFilePath": "/Users/timothy.collins/Documents/ikea work/gm-salesplanning-ai-qa/component-poc/qa-agent/agents/pablo/results/.pablo-jira-ac-20260814-140434.txt"
  },
  "overallStatus": "pass",
  "failureReasons": []
}
